{
  "$schema": "https://raw.githubusercontent.com/ToolJet/ToolJet/develop/plugins/schemas/operations.schema.json",
  "title": "Plivo datasource",
  "description": "A schema defining Plivo datasource",
  "type": "api",
  "defaults": {},
  "properties": {
    "operation": {
      "label": "Operation",
      "key": "operation",
      "type": "dropdown-component-flip",
      "description": "Single select dropdown for operation",
      "list": [
        {
          "value": "send_sms",
          "name": "Send SMS"
        },
        { 
          "value": "make_call",
          "name": "Make Call" 
        }
      ]
    },
    "send_sms": {
      "to": {
        "label": "To Number",
        "key": "to",
        "type": "codehinter",
        "lineNumbers": false,
        "description": "Enter to number",
        "width": "320px",
        "height": "36px",
        "className": "codehinter-plugins"
      },
      "from": {
        "label": "From Number",
        "key": "from",
        "type": "codehinter",
        "lineNumbers": false,
        "description": "Enter from number",
        "width": "320px",
        "height": "36px",
        "className": "codehinter-plugins"
      },
      "body": {
        "label": "Body",
        "key": "body",
        "type": "codehinter",
        "lineNumbers": false,
        "description": "Enter message body",
        "width": "320px",
        "height": "36px",
        "className": "codehinter-plugins",
        "placeholder": "Enter message body"
      }
    },
    "make_call": {
      "from": {
        "label": "From Number",
        "key": "from",
        "type": "codehinter",
        "lineNumbers": false,
        "description": "Enter the Plivo number to call from",
        "width": "320px",
        "height": "36px",
        "className": "codehinter-plugins"
      },
      "to": {
        "label": "To Number",
        "key": "to",
        "type": "codehinter",
        "lineNumbers": false,
        "description": "Enter the number to call",
        "width": "320px",
        "height": "36px",
        "className": "codehinter-plugins"
      },
      "answerUrl": {
        "label": "Answer URL",
        "key": "answerUrl",
        "type": "codehinter",
        "lineNumbers": false,
        "description": "URL Plivo requests for call instructions (Plivo XML) when the call is answered",
        "width": "320px",
        "height": "36px",
        "className": "codehinter-plugins",
        "placeholder": "https://your-server.com/answer_url"
      },
      "answerMethod": {
        "label": "Answer Method",
        "key": "answerMethod",
        "type": "dropdown-component-flip",
        "description": "HTTP method Plivo uses to request the Answer URL",
        "list": [
          { "value": "POST", "name": "POST" },
          { "value": "GET", "name": "GET" }
        ]
      }
    }
  }
}